<?xml version="1.0" encoding="iso-8859-1"?>
<!-- DSC Dsc Export 2010 09 16 -->
<root
      xmlns:xsi="http://www.w3.org/2001/XMLSchema-instance"
      xsi:noNamespaceSchemaLocation="Schema/MaterialGroupPacker.xsd"
      >
  
  <arraySubGroupName>
    <name>body</name>
    <name>fin</name>
    <name>eyelid</name>
  </arraySubGroupName>
  
  <arrayMaterialGroup>
    <!--<materialGroup>
      <name>placeholder</name>
      <needShader>false</needShader>
      <materialSubGroup>
        <visible>true</visible>
        <materialName>placeholdermaterial.data</materialName>
      </materialSubGroup>
      <materialSubGroup>
        <visible>true</visible>
        <materialName>placeholdermaterial.data</materialName>
      </materialSubGroup>
      <materialSubGroup>
        <visible>true</visible>
        <materialName>placeholdermaterial.data</materialName>
      </materialSubGroup>
    </materialGroup>-->

    <materialGroup>
      <name>orange</name>
      <needShader>false</needShader>
      <materialSubGroup>
        <visible>true</visible>
        <materialName>orangematerialbody.data</materialName>
      </materialSubGroup>
      <materialSubGroup>
        <visible>true</visible>
        <materialName>orangematerialfin.data</materialName>
      </materialSubGroup>
      <materialSubGroup>
        <visible>true</visible>
        <materialName>eyelidmaterial.data</materialName>
      </materialSubGroup>
    </materialGroup>    
    
    <materialGroup>
      <name>white</name>
      <needShader>false</needShader>
      <materialSubGroup>
        <visible>true</visible>
        <materialName>whitematerialbody.data</materialName>
      </materialSubGroup>
      <materialSubGroup>
        <visible>true</visible>
        <materialName>whitematerialfin.data</materialName>
      </materialSubGroup>
      <materialSubGroup>
        <visible>true</visible>
        <materialName>eyelidmaterial.data</materialName>
      </materialSubGroup>
    </materialGroup>

    <materialGroup>
      <name>black</name>
      <needShader>false</needShader>
      <materialSubGroup>
        <visible>true</visible>
        <materialName>blackmaterialbody.data</materialName>
      </materialSubGroup>
      <materialSubGroup>
        <visible>true</visible>
        <materialName>blackmaterialfin.data</materialName>
      </materialSubGroup>
      <materialSubGroup>
        <visible>true</visible>
        <materialName>eyelidmaterial.data</materialName>
      </materialSubGroup>
    </materialGroup>
    
    <materialGroup>
      <name>gold</name>
      <needShader>false</needShader>
      <materialSubGroup>
        <visible>true</visible>
        <materialName>goldmaterialbody.data</materialName>
      </materialSubGroup>
      <materialSubGroup>
        <visible>true</visible>
        <materialName>goldmaterialfin.data</materialName>
      </materialSubGroup>
      <materialSubGroup>
        <visible>true</visible>
        <materialName>eyelidmaterial.data</materialName>
      </materialSubGroup>
    </materialGroup>
    
    <materialGroup>
      <name>chromebump</name>
      <needShader>true</needShader>
      <materialSubGroup>
        <visible>true</visible>
        <materialName>chromebumpmaterialbody.data</materialName>
      </materialSubGroup>
      <materialSubGroup>
        <visible>true</visible>
        <materialName>chromebumpmaterialfin.data</materialName>
      </materialSubGroup>
      <materialSubGroup>
        <visible>true</visible>
        <materialName>eyelidmaterial.data</materialName>
      </materialSubGroup>
    </materialGroup>

    <materialGroup>
      <name>chromebump2</name>
      <needShader>true</needShader>
      <materialSubGroup>
        <visible>true</visible>
        <materialName>chromebump2materialbody.data</materialName>
      </materialSubGroup>
      <materialSubGroup>
        <visible>true</visible>
        <materialName>chromebump2materialfin.data</materialName>
      </materialSubGroup>
      <materialSubGroup>
        <visible>true</visible>
        <materialName>eyelidmaterial.data</materialName>
      </materialSubGroup>
    </materialGroup>
    
    <materialGroup>
      <name>chrome</name>
      <needShader>false</needShader>
      <materialSubGroup>
        <visible>true</visible>
        <materialName>chromematerial.data</materialName>
      </materialSubGroup>
      <materialSubGroup>
        <visible>true</visible>
        <materialName>chromematerial.data</materialName>
      </materialSubGroup>
      <materialSubGroup>
        <visible>false</visible>
        <materialName>placeholdermaterialeyelid.data</materialName>
      </materialSubGroup>
    </materialGroup>

    <materialGroup>
      <name>chrome2</name>
      <needShader>false</needShader>
      <materialSubGroup>
        <visible>true</visible>
        <materialName>chromematerial2.data</materialName>
      </materialSubGroup>
      <materialSubGroup>
        <visible>true</visible>
        <materialName>chromematerial2.data</materialName>
      </materialSubGroup>
      <materialSubGroup>
        <visible>false</visible>
        <materialName>placeholdermaterialeyelid.data</materialName>
      </materialSubGroup>
    </materialGroup>
    
  </arrayMaterialGroup>
</root>
